{
  "format": "quickreplay/v1",
  "name": "Playground demo",
  "platform": "android",
  "repeat": 2,
  "loopDelayMs": 500,
  "screen": { "width": 1080, "height": 2400 },
  "steps": [
    { "type": "tap", "x": 300, "y": 900, "delayBeforeMs": 300 },
    { "type": "tap", "x": 540, "y": 1100, "delayBeforeMs": 250 },
    { "type": "tap", "x": 780, "y": 1300, "delayBeforeMs": 250 },
    { "type": "swipe", "delayBeforeMs": 300,
      "points": [ { "x": 540, "y": 2000, "t": 0 }, { "x": 560, "y": 1600, "t": 120 }, { "x": 540, "y": 1000, "t": 300 } ] },
    { "type": "swipe", "delayBeforeMs": 300,
      "points": [ { "x": 150, "y": 1600, "t": 0 }, { "x": 900, "y": 1650, "t": 250 } ] },
    { "type": "longPress", "x": 540, "y": 1800, "durationMs": 900, "delayBeforeMs": 300 },
    { "type": "wait", "ms": 400 }
  ]
}
